{
  "ir_version": "1.0",
  "compiler_version": "1.1",
  "artifact_type": "business_dictionary",
  "generated_at": "2026-06-25T10:19:35Z",
  "repository_commit": "f95b4fe91f273f7a6745f2f7d1de4733757db2dd",
  "provenance": {
    "artifact_id": "ART-GLOSSARY-INV-00001",
    "produced_by": "Phase0_Discovery",
    "consumes": [
      "apps/smriti_retail_os/smriti_retail_os/patches/seed_default_terms.py"
    ],
    "used_by": [
      "docs_renderers",
      "dependency_graph"
    ]
  },
  "data": [
    {
      "term_id": "PSA",
      "term_name": "Party Stock Account",
      "term_category": "Distribution",
      "definition": "Party Stock Account maintains the ledger balances and shadow accounting of stock held by channel partners.",
      "hinglish_definition": "Distributors ya channel partners ke stock balances aur shadow ledger calculations ko track karne wala internal ledger master.",
      "term_aliases": [
        "PSA",
        "Stock Account",
        "Channel Account"
      ],
      "manual_reference": "Volume 3 > Distribution Operations",
      "training_reference": "TRN-DIST-PSA",
      "related_formulas": [],
      "related_terms": [
        "PSV",
        "Party Stock Ledger"
      ],
      "faq": [
        {
          "q": "Does PSA replace ERPNext warehouses?",
          "a": "No, it reads ERPNext master data but acts as an independent shadow ledger."
        }
      ],
      "common_mistakes": [
        {
          "mistake": "Updating general ledger direct",
          "a": "PSA should never write directly to ERPNext General Ledger."
        }
      ],
      "artifact_id": "ART-TERM-00517"
    },
    {
      "term_id": "PSV",
      "term_name": "Party Stock Visibility",
      "term_category": "Distribution",
      "definition": "Party Stock Visibility provides real-time insights into distributor and dealer inventory levels.",
      "hinglish_definition": "Distributors aur secondary retail outlets ke stock levels aur sell-through activity ko monitor karne ki central visual tracking facility.",
      "term_aliases": [
        "PSV",
        "Channel Stock Visibility",
        "Partner Stock"
      ],
      "manual_reference": "Volume 3 > Inventory Analytics",
      "training_reference": "TRN-DIST-PSV",
      "related_formulas": [
        "SAL-001"
      ],
      "related_terms": [
        "PSA",
        "Party Stock Ledger"
      ],
      "faq": [
        {
          "q": "What is primary visibility source?",
          "a": "Daily partner sales uploads and dispatch sync inputs."
        }
      ],
      "common_mistakes": [
        {
          "mistake": "Mixing company warehouse with partner stock",
          "a": "Partner stock belongs to distributors, not the company warehouses."
        }
      ],
      "artifact_id": "ART-TERM-00518"
    },
    {
      "term_id": "PDT",
      "term_name": "Predictive Distribution Twin",
      "term_category": "Forecasting",
      "definition": "Predictive Distribution Twin utilizes historical demand, lead time, and variance parameters to optimize replenishment across outlets.",
      "hinglish_definition": "Sales history, lead time, aur safety stock factors ke analytics par chalne wala intelligent store replenishment algorithm.",
      "term_aliases": [
        "PDT",
        "Replenishment Engine",
        "Stock Planner"
      ],
      "manual_reference": "Volume 4 > Replenishment Science",
      "training_reference": "TRN-PDT-01",
      "related_formulas": [
        "FRC-001",
        "TRF-001"
      ],
      "related_terms": [
        "WOC",
        "Reorder Suggestion"
      ],
      "faq": [
        {
          "q": "How often does PDT rebuild?",
          "a": "Automatically overnight, or manually from the PDT dashboard."
        }
      ],
      "common_mistakes": [
        {
          "mistake": "Running plan without approving registry rules",
          "a": "Always ensure CGE and reorder rules are approved."
        }
      ],
      "artifact_id": "ART-TERM-00519"
    },
    {
      "term_id": "WOC",
      "term_name": "Weeks of Cover",
      "term_category": "Inventory",
      "definition": "Weeks of Cover is the duration in weeks that current stock will last based on standard weekly sales velocity.",
      "hinglish_definition": "Warehouse ya store mein pada hua stock, average weekly sales velocity ke hisaab se kitne weeks tak chalega.",
      "term_aliases": [
        "WOC",
        "Weeks of Cover",
        "Inventory Coverage",
        "Stock Cover"
      ],
      "manual_reference": "Volume 3 > Inventory Control",
      "training_reference": "TRN-INV-WOC",
      "related_formulas": [
        "INV-002"
      ],
      "related_terms": [
        "Sales Velocity",
        "Stockout Risk"
      ],
      "faq": [
        {
          "q": "What is normal safety WOC limit?",
          "a": "Typically 3 to 4 weeks depending on replenishment lead time."
        }
      ],
      "common_mistakes": [
        {
          "mistake": "Ignoring seasonal velocity changes",
          "a": "Static WOC calculations during festival seasons will lead to stockouts."
        }
      ],
      "artifact_id": "ART-TERM-00520"
    },
    {
      "term_id": "Sales Velocity",
      "term_name": "Sales Velocity",
      "term_category": "Sales",
      "definition": "Weekly sales velocity calculated over a lookback window (standard 30 days).",
      "hinglish_definition": "Kisi specific period (lookback window) ke sales data par calculate ki gayi average weekly product sales velocity.",
      "term_aliases": [
        "Sales Velocity",
        "Velocity",
        "Weekly Sales Rate"
      ],
      "manual_reference": "Volume 3 > Sales Analytics",
      "training_reference": "TRN-SAL-VEL",
      "related_formulas": [
        "INV-001"
      ],
      "related_terms": [
        "WOC"
      ],
      "faq": [
        {
          "q": "Why 30-day default window?",
          "a": "To smooth out short-term weekend spikes while retaining recent demand trends."
        }
      ],
      "common_mistakes": [
        {
          "mistake": "Using velocity on new launches",
          "a": "For items with < 14 days history, use variant curves instead of sales velocity."
        }
      ],
      "artifact_id": "ART-TERM-00521"
    },
    {
      "term_id": "Forecast Confidence",
      "term_name": "Forecast Confidence Score",
      "term_category": "Forecasting",
      "definition": "Calculated score indicating reliability of forecasted demand based on demand volatility (Coefficient of Variation).",
      "hinglish_definition": "Demand volatility ke parameters (Coefficient of Variation) par system forecast confidence score check karta hai.",
      "term_aliases": [
        "Forecast Confidence",
        "Confidence Score",
        "Forecasting Reliability"
      ],
      "manual_reference": "Volume 4 > Forecasting Science",
      "training_reference": "TRN-FRC-CONF",
      "related_formulas": [
        "FRC-001"
      ],
      "related_terms": [
        "PDT",
        "Reorder Suggestion"
      ],
      "faq": [
        {
          "q": "What lowers confidence?",
          "a": "Erratic sales, highly sparse transaction history, and frequent stockouts."
        }
      ],
      "common_mistakes": [
        {
          "mistake": "Assuming 100% confidence means exact sales",
          "a": "Forecast is probabilistic; always consider lead time tolerance."
        }
      ],
      "artifact_id": "ART-TERM-00522"
    },
    {
      "term_id": "Dead Stock",
      "term_name": "Dead Stock Score",
      "term_category": "Inventory",
      "definition": "Evaluates stock aging and inactive sales duration to calculate stock liquidation priority score.",
      "hinglish_definition": "Aise inventory items jo kaafi time se sell nahi hue hain, unki static duration par dead stock score nikaala jaata hai.",
      "term_aliases": [
        "Dead Stock",
        "Liquidation Score",
        "Slow Moving Stock"
      ],
      "manual_reference": "Volume 3 > Inventory Valuation",
      "training_reference": "TRN-INV-DEAD",
      "related_formulas": [
        "INV-003"
      ],
      "related_terms": [
        "WOC"
      ],
      "faq": [
        {
          "q": "When is an item marked critical?",
          "a": "When inactive days exceed 90 days with positive stock value."
        }
      ],
      "common_mistakes": [
        {
          "mistake": "Failing to discount dead stock early",
          "a": "Liquidation margins drop further the longer dead stock stays on shelves."
        }
      ],
      "artifact_id": "ART-TERM-00523"
    },
    {
      "term_id": "Sell Through",
      "term_name": "Sell Through Percentage",
      "term_category": "Sales",
      "definition": "Percentage of received inventory sold within a specified sales cycle.",
      "hinglish_definition": "Ek specific stock batch mein se kitne percent mal customer ko sell ho chuka hai (total sales quantity divided by opening stock plus receipts).",
      "term_aliases": [
        "Sell Through",
        "Sell Through %",
        "ST%"
      ],
      "manual_reference": "Volume 3 > Sales Performance",
      "training_reference": "TRN-SAL-ST",
      "related_formulas": [
        "SAL-001"
      ],
      "related_terms": [
        "Sales Velocity"
      ],
      "faq": [
        {
          "q": "What is a healthy ST%?",
          "a": "Above 60% within 8 weeks of launch is considered strong retail performance."
        }
      ],
      "common_mistakes": [
        {
          "mistake": "Excluding initial opening stock",
          "a": "Always add initial opening stock in the denominator to reflect true visibility."
        }
      ],
      "artifact_id": "ART-TERM-00524"
    },
    {
      "term_id": "Stock Accuracy",
      "term_name": "Stock Accuracy Score",
      "term_category": "Audit",
      "definition": "Measures variance between physical inventory count values and system ledger balances.",